{
    "contexts": [
        {"context_id": {"context_uuid": {"uuid": "admin"}}}
    ],
    "topologies": [
        {"topology_id": {"context_id": {"context_uuid": {"uuid": "admin"}}, "topology_uuid": {"uuid": "admin"}}}
    ],
    "devices": [
        {
            "device_id": {"device_uuid": {"uuid": "router1"}},
            "device_type": "packet-router",
            "device_drivers": ["DEVICEDRIVER_GNMI_OPENCONFIG"],
            "device_operational_status": 1,
            "device_config": {"config_rules": [
                {"action": 1, "custom": {"resource_key": "_connect/address", "resource_value": "172.20.20.2"}},
                {"action": 1, "custom": {"resource_key": "_connect/port", "resource_value": "6030"}},
                {"action": 1, "custom": {"resource_key": "_connect/settings", "resource_value": {"protocol": "gnmi", "username": "admin", "password": "admin", "use_tls": false}}}
            ]}
        },
        {
            "device_id": {"device_uuid": {"uuid": "router2"}},
            "device_type": "packet-router",
            "device_drivers": ["DEVICEDRIVER_GNMI_OPENCONFIG"],
            "device_operational_status": 1,
            "device_config": {"config_rules": [
                {"action": 1, "custom": {"resource_key": "_connect/address", "resource_value": "172.20.20.3"}},
                {"action": 1, "custom": {"resource_key": "_connect/port", "resource_value": "6030"}},
                {"action": 1, "custom": {"resource_key": "_connect/settings", "resource_value": {"protocol": "gnmi", "username": "admin", "password": "admin", "use_tls": false}}}
            ]}
        },
        {
            "device_id": {"device_uuid": {"uuid": "dc1"}},
            "device_type": "emu-datacenter",
            "device_drivers": ["DEVICEDRIVER_UNDEFINED"],
            "device_operational_status": 1,
            "device_config": {"config_rules": [
                {"action": 1, "custom": {"resource_key": "_connect/address", "resource_value": "127.0.0.1"}},
                {"action": 1, "custom": {"resource_key": "_connect/port", "resource_value": "0"}},
                {"action": 1, "custom": {"resource_key": "_connect/settings", "resource_value": {
                    "endpoints": [{"uuid": "eth1", "type": "copper"}]
                }}}
            ]}
        },
        {
            "device_id": {"device_uuid": {"uuid": "dc2"}},
            "device_type": "emu-datacenter",
            "device_drivers": ["DEVICEDRIVER_UNDEFINED"],
            "device_operational_status": 1,
            "device_config": {"config_rules": [
                {"action": 1, "custom": {"resource_key": "_connect/address", "resource_value": "127.0.0.1"}},
                {"action": 1, "custom": {"resource_key": "_connect/port", "resource_value": "0"}},
                {"action": 1, "custom": {"resource_key": "_connect/settings", "resource_value": {
                    "endpoints": [{"uuid": "eth1", "type": "copper"}]
                }}}
            ]}
        }
    ],
    "links": [
        {
            "link_id": {"link_uuid": {"uuid": "router1/Ethernet1==router2/Ethernet1"}},
            "link_endpoint_ids": [
                {"device_id": {"device_uuid": {"uuid": "router1"}}, "endpoint_uuid": {"uuid": "Ethernet1"}},
                {"device_id": {"device_uuid": {"uuid": "router2"}}, "endpoint_uuid": {"uuid": "Ethernet1"}}
            ]
        },
        {
            "link_id": {"link_uuid": {"uuid": "router1/Ethernet10==dc1/eth1"}},
            "link_endpoint_ids": [
                {"device_id": {"device_uuid": {"uuid": "router1"}}, "endpoint_uuid": {"uuid": "Ethernet10"}},
                {"device_id": {"device_uuid": {"uuid": "dc1"}}, "endpoint_uuid": {"uuid": "eth1"}}
            ]
        },
        {
            "link_id": {"link_uuid": {"uuid": "router2/Ethernet10==dc2/eth1"}},
            "link_endpoint_ids": [
                {"device_id": {"device_uuid": {"uuid": "router2"}}, "endpoint_uuid": {"uuid": "Ethernet10"}},
                {"device_id": {"device_uuid": {"uuid": "dc2"}}, "endpoint_uuid": {"uuid": "eth1"}}
            ]
        },
                {
            "link_id": {"link_uuid": {"uuid": "router2/Ethernet1==router1/Ethernet1"}},
            "link_endpoint_ids": [
                {"device_id": {"device_uuid": {"uuid": "router2"}}, "endpoint_uuid": {"uuid": "Ethernet1"}},
                {"device_id": {"device_uuid": {"uuid": "router1"}}, "endpoint_uuid": {"uuid": "Ethernet1"}}
            ]
        },
        {
            "link_id": {"link_uuid": {"uuid": "dc1/eth1==router1/Ethernet10"}},
            "link_endpoint_ids": [
                {"device_id": {"device_uuid": {"uuid": "dc1"}}, "endpoint_uuid": {"uuid": "eth1"}},
                {"device_id": {"device_uuid": {"uuid": "router1"}}, "endpoint_uuid": {"uuid": "Ethernet10"}}
            ]
        },
        {
            "link_id": {"link_uuid": {"uuid": "dc2/eth1==router2/Ethernet10"}},
            "link_endpoint_ids": [
                {"device_id": {"device_uuid": {"uuid": "dc2"}}, "endpoint_uuid": {"uuid": "eth1"}},
                {"device_id": {"device_uuid": {"uuid": "router2"}}, "endpoint_uuid": {"uuid": "Ethernet10"}}
            ]
        },
        {
            "link_id": {"link_uuid": {"uuid": "router2/Ethernet1==router1/Ethernet1"}},
            "link_endpoint_ids": [
                {"device_id": {"device_uuid": {"uuid": "router2"}}, "endpoint_uuid": {"uuid": "Ethernet1"}},
                {"device_id": {"device_uuid": {"uuid": "router1"}}, "endpoint_uuid": {"uuid": "Ethernet1"}}
            ]
        },
        {
            "link_id": {"link_uuid": {"uuid": "dc1/eth1==router1/Ethernet10"}},
            "link_endpoint_ids": [
                {"device_id": {"device_uuid": {"uuid": "dc1"}}, "endpoint_uuid": {"uuid": "eth1"}},
                {"device_id": {"device_uuid": {"uuid": "router1"}}, "endpoint_uuid": {"uuid": "Ethernet10"}}
            ]
        }
    ]
}